{
  "meta": {
    "project": "Prompt-Bibliothek",
    "version": "3.0.0-migrated",
    "author": "Sarah Bormann",
    "locale": "de-DE",
    "description": "Aus einem V2-Modell migriertes V3-Zielmodell. Der Kern bildet eine single-select Taxonomie mit getrenntem Generator- und optionalem Heuristik-Layer.",
    "model_principles": [
      "single_select_per_slot",
      "snake_case_values",
      "uppercase_slot_keys",
      "taxonomy_first",
      "generator_second",
      "heuristics_optional"
    ]
  },
  "dimensions": [
    {
      "id": "A",
      "key": "ZIEL",
      "label": "Ziel",
      "description": "Wozu dient der Prompt? Was soll mit dem Ergebnis erreicht werden?",
      "slot_order": [
        "ZIEL_TYP",
        "ZIEL_REIFE"
      ]
    },
    {
      "id": "B",
      "key": "AUFGABE",
      "label": "Aufgabe",
      "description": "Was genau soll die KI tun?",
      "slot_order": [
        "AUFGABENTYP",
        "AUFGABENSTRUKTUR"
      ]
    },
    {
      "id": "C",
      "key": "KONTEXT",
      "label": "Kontext",
      "description": "In welcher Nutzungslage und fuer welche Zielgruppe wird gearbeitet?",
      "slot_order": [
        "SITUATIONSKONTEXT",
        "ZIELGRUPPE",
        "WISSENSNIVEAU",
        "RAHMENBEDINGUNG"
      ]
    },
    {
      "id": "D",
      "key": "PROZESS",
      "label": "Prozess",
      "description": "Wie soll die KI vorgehen und wie soll die Zusammenarbeit im Chat ablaufen?",
      "slot_order": [
        "PROZESSLOGIK",
        "METHODIK",
        "INTERAKTIONSMODUS",
        "STEUERUNGSGRAD",
        "ARBEITSMODUS"
      ]
    },
    {
      "id": "E",
      "key": "OUTPUT",
      "label": "Output",
      "description": "In welcher Form und mit welchem Ergebnisfokus soll geliefert werden?",
      "slot_order": [
        "FORMAT",
        "UMFANG",
        "ERGEBNISFOKUS"
      ]
    },
    {
      "id": "F",
      "key": "STIL",
      "label": "Stil",
      "description": "Wie soll die Antwort sprachlich und rollenbezogen klingen?",
      "slot_order": [
        "TONALITAET",
        "DIREKTHEIT",
        "ROLLENSTIMME"
      ]
    },
    {
      "id": "G",
      "key": "KRITERIEN",
      "label": "Kriterien",
      "description": "Woran wird eine gute Antwort gemessen und welche Trade-offs gelten?",
      "slot_order": [
        "QUALITAETSFOKUS",
        "PRIORISIERUNG",
        "TIEFENGRAD"
      ]
    },
    {
      "id": "H",
      "key": "GRENZEN",
      "label": "Grenzen",
      "description": "Was soll ausgeschlossen, begrenzt oder formal vermieden werden?",
      "slot_order": [
        "EVIDENZREGEL",
        "TABELLENREGEL",
        "LISTENREGEL",
        "BEISPIELREGEL",
        "METAREGEL",
        "REDUNDANZREGEL"
      ]
    }
  ],
  "slots": [
    {
      "id": "A1",
      "key": "ZIEL_TYP",
      "label": "Zieltyp",
      "dimension": "ZIEL",
      "required": true,
      "multi": false,
      "value_set": "ziel_typ",
      "description": "Primaerer Zweck des Ergebnisses."
    },
    {
      "id": "A2",
      "key": "ZIEL_REIFE",
      "label": "Zielreife",
      "dimension": "ZIEL",
      "required": false,
      "multi": false,
      "value_set": "ziel_reife",
      "description": "Praktische Reife des Ergebnisses."
    },
    {
      "id": "B1",
      "key": "AUFGABENTYP",
      "label": "Aufgabentyp",
      "dimension": "AUFGABE",
      "required": true,
      "multi": false,
      "value_set": "aufgabentyp",
      "description": "Konkrete Operation, die die KI ausfuehren soll."
    },
    {
      "id": "B2",
      "key": "AUFGABENSTRUKTUR",
      "label": "Aufgabenstruktur",
      "dimension": "AUFGABE",
      "required": false,
      "multi": false,
      "value_set": "aufgabenstruktur",
      "description": "Einzelschritt oder mehrstufig."
    },
    {
      "id": "C1",
      "key": "SITUATIONSKONTEXT",
      "label": "Situationskontext",
      "dimension": "KONTEXT",
      "required": true,
      "multi": false,
      "value_set": "situationskontext",
      "description": "Primaere Nutzungslage des Prompts."
    },
    {
      "id": "C2",
      "key": "ZIELGRUPPE",
      "label": "Zielgruppe",
      "dimension": "KONTEXT",
      "required": true,
      "multi": false,
      "value_set": "zielgruppe",
      "description": "Fuer wen das Ergebnis gedacht ist."
    },
    {
      "id": "C3",
      "key": "WISSENSNIVEAU",
      "label": "Wissensniveau",
      "dimension": "KONTEXT",
      "required": false,
      "multi": false,
      "value_set": "wissensniveau",
      "description": "Vorkenntnisniveau, auf das der Prompt ausgerichtet wird."
    },
    {
      "id": "C4",
      "key": "RAHMENBEDINGUNG",
      "label": "Rahmenbedingung",
      "dimension": "KONTEXT",
      "required": false,
      "multi": false,
      "value_set": "rahmenbedingung",
      "description": "Besondere Arbeitslage wie Zeitdruck oder sensible Kommunikation."
    },
    {
      "id": "D1",
      "key": "PROZESSLOGIK",
      "label": "Prozesslogik",
      "dimension": "PROZESS",
      "required": false,
      "multi": false,
      "value_set": "prozesslogik",
      "description": "Reihenfolge der Bearbeitungsschritte."
    },
    {
      "id": "D2",
      "key": "METHODIK",
      "label": "Methodik",
      "dimension": "PROZESS",
      "required": false,
      "multi": false,
      "value_set": "methodik",
      "description": "Konkreter methodischer Arbeitsrahmen."
    },
    {
      "id": "D3",
      "key": "INTERAKTIONSMODUS",
      "label": "Interaktionsmodus",
      "dimension": "PROZESS",
      "required": false,
      "multi": false,
      "value_set": "interaktionsmodus",
      "description": "Wie die Zusammenarbeit im Chat ablaufen soll."
    },
    {
      "id": "D4",
      "key": "STEUERUNGSGRAD",
      "label": "Steuerungsgrad",
      "dimension": "PROZESS",
      "required": false,
      "multi": false,
      "value_set": "steuerungsgrad",
      "description": "Wie eng oder offen die Bearbeitung gefuehrt wird."
    },
    {
      "id": "D5",
      "key": "ARBEITSMODUS",
      "label": "Arbeitsmodus",
      "dimension": "PROZESS",
      "required": false,
      "multi": false,
      "value_set": "arbeitsmodus",
      "description": "Kognitiver Bearbeitungsstil."
    },
    {
      "id": "E1",
      "key": "FORMAT",
      "label": "Format",
      "dimension": "OUTPUT",
      "required": true,
      "multi": false,
      "value_set": "format",
      "description": "Form des Ergebnisses."
    },
    {
      "id": "E2",
      "key": "UMFANG",
      "label": "Umfang",
      "dimension": "OUTPUT",
      "required": false,
      "multi": false,
      "value_set": "umfang",
      "description": "Gewuenschte Laenge oder Detailliertheit."
    },
    {
      "id": "E3",
      "key": "ERGEBNISFOKUS",
      "label": "Ergebnisfokus",
      "dimension": "OUTPUT",
      "required": false,
      "multi": false,
      "value_set": "ergebnisfokus",
      "description": "Welche Art von Deliverable im Vordergrund steht."
    },
    {
      "id": "F1",
      "key": "TONALITAET",
      "label": "Tonalitaet",
      "dimension": "STIL",
      "required": false,
      "multi": false,
      "value_set": "tonalitaet",
      "description": "Sprachlicher Grundton der Antwort."
    },
    {
      "id": "F2",
      "key": "DIREKTHEIT",
      "label": "Direktheit",
      "dimension": "STIL",
      "required": false,
      "multi": false,
      "value_set": "direktheit",
      "description": "Wie direkt oder zurueckhaltend formuliert werden soll."
    },
    {
      "id": "F3",
      "key": "ROLLENSTIMME",
      "label": "Rollenstimme",
      "dimension": "STIL",
      "required": false,
      "multi": false,
      "value_set": "rollenstimme",
      "description": "Rollenbezogene Sprachfigur."
    },
    {
      "id": "G1",
      "key": "QUALITAETSFOKUS",
      "label": "Qualitaetsfokus",
      "dimension": "KRITERIEN",
      "required": true,
      "multi": false,
      "value_set": "qualitaetsfokus",
      "description": "Zentrales Qualitaetskriterium der Antwort."
    },
    {
      "id": "G2",
      "key": "PRIORISIERUNG",
      "label": "Priorisierung",
      "dimension": "KRITERIEN",
      "required": false,
      "multi": false,
      "value_set": "priorisierung",
      "description": "Trade-off-Regel bei konkurrierenden Anforderungen."
    },
    {
      "id": "G3",
      "key": "TIEFENGRAD",
      "label": "Tiefengrad",
      "dimension": "KRITERIEN",
      "required": false,
      "multi": false,
      "value_set": "tiefengrad",
      "description": "Gewuenschte analytische oder inhaltliche Tiefe."
    },
    {
      "id": "H1",
      "key": "EVIDENZREGEL",
      "label": "Evidenzregel",
      "dimension": "GRENZEN",
      "required": false,
      "multi": false,
      "value_set": "evidenzregel",
      "description": "Regel fuer Spekulation, Belegpflicht und Unsicherheiten."
    },
    {
      "id": "H2",
      "key": "TABELLENREGEL",
      "label": "Tabellenregel",
      "dimension": "GRENZEN",
      "required": false,
      "multi": false,
      "value_set": "tabellenregel",
      "description": "Ob Tabellen vermieden oder erlaubt sind."
    },
    {
      "id": "H3",
      "key": "LISTENREGEL",
      "label": "Listenregel",
      "dimension": "GRENZEN",
      "required": false,
      "multi": false,
      "value_set": "listenregel",
      "description": "Ob Listen vermieden oder erlaubt sind."
    },
    {
      "id": "H4",
      "key": "BEISPIELREGEL",
      "label": "Beispielregel",
      "dimension": "GRENZEN",
      "required": false,
      "multi": false,
      "value_set": "beispielregel",
      "description": "Ob Beispiele verwendet werden duerfen."
    },
    {
      "id": "H5",
      "key": "METAREGEL",
      "label": "Metaregel",
      "dimension": "GRENZEN",
      "required": false,
      "multi": false,
      "value_set": "metaregel",
      "description": "Regel fuer Meta-Erklaerungen ueber das eigene Vorgehen."
    },
    {
      "id": "H6",